{"SPDXID":"SPDXRef-DOCUMENT","creationInfo":{"created":"1970-01-01T00:00:00Z","creators":["Tool: contracts-fixture/1"]},"dataLicense":"CC0-1.0","documentNamespace":"https://spdx.bangumi-staff-stats.invalid/backend/sha256-094c89e3bb8ff11d31388e75dcbd72e05cb96b089cbba957a9213934440e48a6","name":"bangumi-staff-stats-backend-fixture","packages":[{"SPDXID":"SPDXRef-Package-artifact","checksums":[{"algorithm":"SHA256","checksumValue":"094c89e3bb8ff11d31388e75dcbd72e05cb96b089cbba957a9213934440e48a6"}],"copyrightText":"NOASSERTION","downloadLocation":"NOASSERTION","filesAnalyzed":false,"licenseConcluded":"NOASSERTION","licenseDeclared":"NOASSERTION","name":"backend-fixture","primaryPackagePurpose":"APPLICATION","versionInfo":"v0.1.0"},{"SPDXID":"SPDXRef-Package-go-runtime","copyrightText":"NOASSERTION","downloadLocation":"NOASSERTION","filesAnalyzed":false,"licenseConcluded":"BSD-3-Clause","licenseDeclared":"BSD-3-Clause","name":"go-runtime","primaryPackagePurpose":"LIBRARY","versionInfo":"1.26.5"}],"relationships":[{"relatedSpdxElement":"SPDXRef-Package-artifact","relationshipType":"DESCRIBES","spdxElementId":"SPDXRef-DOCUMENT"},{"relatedSpdxElement":"SPDXRef-Package-go-runtime","relationshipType":"DEPENDS_ON","spdxElementId":"SPDXRef-Package-artifact"}],"spdxVersion":"SPDX-2.3"}
