{"SPDXID":"SPDXRef-DOCUMENT","creationInfo":{"created":"1970-01-01T00:00:00Z","creators":["Tool: contracts-fixture/1"]},"dataLicense":"CC0-1.0","documentNamespace":"https://spdx.bangumi-staff-stats.invalid/updater/sha256-16066ef10214d830f9d879a30c2b7c8096cc6e182b26adc56357a0ecdd5be185","name":"bangumi-staff-stats-updater-fixture","packages":[{"SPDXID":"SPDXRef-Package-artifact","checksums":[{"algorithm":"SHA256","checksumValue":"16066ef10214d830f9d879a30c2b7c8096cc6e182b26adc56357a0ecdd5be185"}],"copyrightText":"NOASSERTION","downloadLocation":"NOASSERTION","filesAnalyzed":false,"licenseConcluded":"NOASSERTION","licenseDeclared":"NOASSERTION","name":"updater-fixture","primaryPackagePurpose":"APPLICATION","versionInfo":"v0.1.0"},{"SPDXID":"SPDXRef-Package-python-runtime","copyrightText":"NOASSERTION","downloadLocation":"NOASSERTION","filesAnalyzed":false,"licenseConcluded":"PSF-2.0","licenseDeclared":"PSF-2.0","name":"python-runtime","primaryPackagePurpose":"LIBRARY","versionInfo":"3.14.6"}],"relationships":[{"relatedSpdxElement":"SPDXRef-Package-artifact","relationshipType":"DESCRIBES","spdxElementId":"SPDXRef-DOCUMENT"},{"relatedSpdxElement":"SPDXRef-Package-python-runtime","relationshipType":"DEPENDS_ON","spdxElementId":"SPDXRef-Package-artifact"}],"spdxVersion":"SPDX-2.3"}
