{"SPDXID":"SPDXRef-DOCUMENT","creationInfo":{"created":"1970-01-01T00:00:00Z","creators":["Tool: contracts-fixture/1"]},"dataLicense":"CC0-1.0","documentNamespace":"https://spdx.bangumi-staff-stats.invalid/frontend/sha256-fd66b37177fb676be8b7488cd9844a6d79c9573b61d0b00c29bf7dee316f36d2","name":"bangumi-staff-stats-frontend-fixture","packages":[{"SPDXID":"SPDXRef-Package-artifact","checksums":[{"algorithm":"SHA256","checksumValue":"fd66b37177fb676be8b7488cd9844a6d79c9573b61d0b00c29bf7dee316f36d2"}],"copyrightText":"NOASSERTION","downloadLocation":"NOASSERTION","filesAnalyzed":false,"licenseConcluded":"NOASSERTION","licenseDeclared":"NOASSERTION","name":"frontend-fixture","primaryPackagePurpose":"APPLICATION","versionInfo":"v0.1.0"},{"SPDXID":"SPDXRef-Package-vue","copyrightText":"NOASSERTION","downloadLocation":"NOASSERTION","filesAnalyzed":false,"licenseConcluded":"MIT","licenseDeclared":"MIT","name":"vue","primaryPackagePurpose":"LIBRARY","versionInfo":"3.5.30"}],"relationships":[{"relatedSpdxElement":"SPDXRef-Package-artifact","relationshipType":"DESCRIBES","spdxElementId":"SPDXRef-DOCUMENT"},{"relatedSpdxElement":"SPDXRef-Package-vue","relationshipType":"DEPENDS_ON","spdxElementId":"SPDXRef-Package-artifact"}],"spdxVersion":"SPDX-2.3"}
